[
  {
    "id": 36949,
    "date": "2026-05-12T01:00:50",
    "title": {
      "rendered": "Appropriation or fusion: student thoughts on Stav food stall names"
    },
    "categories": [1140, 1139],
    "featured_media": 35393
  },
  {
    "id": 36981,
    "date": "2026-05-12T01:00:39",
    "title": {
      "rendered": "International perspectives to a universal quest"
    },
    "categories": [1140, 1139],
    "featured_media": 35393
  },
  {
    "id": 36984,
    "date": "2026-05-12T01:00:34",
    "title": {
      "rendered": "Letter from The Editors: DEI in Transition"
    },
    "categories": [1140, 1139],
    "featured_media": 0
  },
  {
    "id": 36941,
    "date": "2026-05-12T01:00:30",
    "title": {
      "rendered": "The continuous conversation surrounding accessibility at St. Olaf"
    },
    "categories": [1140, 1139],
    "featured_media": 36944
  },
  {
    "id": 36959,
    "date": "2026-05-12T01:00:29",
    "title": {
      "rendered": "The true cost of convenience: AI in the classroom"
    },
    "categories": [1140, 1139],
    "featured_media": 36960
  },
  {
    "id": 36937,
    "date": "2026-05-12T01:00:28",
    "title": {
      "rendered": "The language of inclusivity"
    },
    "categories": [1140, 1139],
    "featured_media": 36940
  },
  {
    "id": 36948,
    "date": "2026-05-12T01:00:23",
    "title": {
      "rendered": "Finding peace on campus"
    },
    "categories": [1140, 1139],
    "featured_media": 36950
  },
  {
    "id": 36963,
    "date": "2026-05-12T01:00:22",
    "title": {
      "rendered": "Reflections of a studio art major on diversity in St. Olaf art courses"
    },
    "categories": [1140, 1139],
    "featured_media": 35393
  },
  {
    "id": 36971,
    "date": "2026-05-12T01:00:20",
    "title": {
      "rendered": "Is St. Olaf sacrificing prestige for accessibility?"
    },
    "categories": [1140, 1139],
    "featured_media": 36973
  },
  {
    "id": 36939,
    "date": "2026-05-12T01:00:19",
    "title": {
      "rendered": "Is Russian language a dying major?"
    },
    "categories": [1140, 1139],
    "featured_media": 36956
  },
  {
    "id": 36936,
    "date": "2026-05-12T01:00:02",
    "title": {
      "rendered": "Beyond the binary: the gaps in St. Olaf’s “gender-inclusive” housing"
    },
    "categories": [1140, 1139],
    "featured_media": 36943
  },
  {
    "id": 36986,
    "date": "2026-05-07T14:38:21",
    "title": {
      "rendered": "St. Olaf faculty votes to replace six-year rule for non-tenure faculty members"
    },
    "categories": [7],
    "featured_media": 36987
  },
  {
    "id": 36911,
    "date": "2026-04-29T18:45:07",
    "title": {
      "rendered": "Cows, Comments and Confessions: Ashlyn and Kenzie have thoughts"
    },
    "categories": [8],
    "featured_media": 36913
  },
  {
    "id": 36907,
    "date": "2026-04-29T17:47:26",
    "title": {
      "rendered": "SGA partners with the Piper Center to bring students blazers on loan"
    },
    "categories": [7],
    "featured_media": 36908
  },
  {
    "id": 36900,
    "date": "2026-04-29T17:43:27",
    "title": {
      "rendered": "SGA passes proposal for new water bottle fillers to be installed in select residence halls"
    },
    "categories": [7],
    "featured_media": 36903
  },
  {
    "id": 36904,
    "date": "2026-04-29T17:43:21",
    "title": {
      "rendered": "SGA passes proposal to provide new library seating"
    },
    "categories": [7],
    "featured_media": 35393
  },
  {
    "id": 36896,
    "date": "2026-04-29T17:34:26",
    "title": {
      "rendered": "St. Olaf awarded 2026-27 Hunger Free Campus grant"
    },
    "categories": [45, 7],
    "featured_media": 36902
  },
  {
    "id": 36894,
    "date": "2026-04-29T17:34:00",
    "title": {
      "rendered": "Just follow the yellow brick road to success: St. Olaf alum Becca Hart ’14 stars in the Children’s Theatre Company’s production of “The Wizard of Oz”"
    },
    "categories": [4],
    "featured_media": 36897
  },
  {
    "id": 36890,
    "date": "2026-04-29T17:32:01",
    "title": {
      "rendered": "City Council hears update on Phase II of Northfield Skate Park"
    },
    "categories": [7],
    "featured_media": 35393
  },
  {
    "id": 36883,
    "date": "2026-04-29T17:30:37",
    "title": {
      "rendered": "St. Olaf Berzerkers’ road to nationals"
    },
    "categories": [6],
    "featured_media": 36861
  },
  {
    "id": 36889,
    "date": "2026-04-29T17:30:32",
    "title": {
      "rendered": "“Almost, Maine”: an entirely wonderful production"
    },
    "categories": [4],
    "featured_media": 35393
  },
  {
    "id": 36880,
    "date": "2026-04-29T17:29:12",
    "title": {
      "rendered": "Meet the President’s Leadership Team"
    },
    "categories": [7],
    "featured_media": 35393
  },
  {
    "id": 36885,
    "date": "2026-04-29T17:28:35",
    "title": {
      "rendered": "StoReview: A chaotic love story, “The Drama”"
    },
    "categories": [4, 1082],
    "featured_media": 36887
  },
  {
    "id": 36879,
    "date": "2026-04-29T17:27:26",
    "title": {
      "rendered": "A&#038;Eats: Senior edition"
    },
    "categories": [4],
    "featured_media": 36881
  },
  {
    "id": 36875,
    "date": "2026-04-29T17:26:37",
    "title": {
      "rendered": "Reflections from the Hill: senior athletes graduating"
    },
    "categories": [45, 6],
    "featured_media": 36860
  },
  {
    "id": 36876,
    "date": "2026-04-29T17:24:43",
    "title": {
      "rendered": "Heartbeat"
    },
    "categories": [4, 50],
    "featured_media": 35717
  },
  {
    "id": 36859,
    "date": "2026-04-29T17:24:19",
    "title": {
      "rendered": "Student workers deliver petition urging St. Olaf to reverse work award cap policy"
    },
    "categories": [45, 7],
    "featured_media": 36868
  },
  {
    "id": 36872,
    "date": "2026-04-29T17:23:22",
    "title": {
      "rendered": "My favorite summer games"
    },
    "categories": [6],
    "featured_media": 35393
  },
  {
    "id": 36870,
    "date": "2026-04-29T17:21:38",
    "title": {
      "rendered": "St. Olaf students set a new record by climbing Mount Everest in Larson Hall"
    },
    "categories": [48, 6],
    "featured_media": 36862
  },
  {
    "id": 36867,
    "date": "2026-04-29T17:17:56",
    "title": {
      "rendered": "Club sport spotlight: Women’s Lacrosse"
    },
    "categories": [941, 6],
    "featured_media": 36864
  },
  {
    "id": 36858,
    "date": "2026-04-29T17:15:42",
    "title": {
      "rendered": "St. Olaf Dance Team sees success at College Classic National Championships"
    },
    "categories": [48, 6],
    "featured_media": 36863
  },
  {
    "id": 36853,
    "date": "2026-04-29T17:02:01",
    "title": {
      "rendered": "A review of the 2025-26 St. Olaf experience"
    },
    "categories": [8],
    "featured_media": 36856
  },
  {
    "id": 36850,
    "date": "2026-04-29T16:57:48",
    "title": {
      "rendered": "Epilogue: the last echo"
    },
    "categories": [70, 23],
    "featured_media": 0
  },
  {
    "id": 36847,
    "date": "2026-04-29T16:57:29",
    "title": {
      "rendered": "Record Store Day 2026 reactions"
    },
    "categories": [8],
    "featured_media": 36851
  },
  {
    "id": 36845,
    "date": "2026-04-29T16:55:58",
    "title": {
      "rendered": "Senior sunset"
    },
    "categories": [67, 23],
    "featured_media": 36848
  },
  {
    "id": 36841,
    "date": "2026-04-29T16:55:20",
    "title": {
      "rendered": "Unc advice column"
    },
    "categories": [8],
    "featured_media": 35393
  },
  {
    "id": 36843,
    "date": "2026-04-29T16:54:08",
    "title": {
      "rendered": "Spotify playlist: A very MESSy playlist"
    },
    "categories": [68, 23],
    "featured_media": 0
  },
  {
    "id": 36838,
    "date": "2026-04-29T16:53:18",
    "title": {
      "rendered": "Spotify playlist: red into blue"
    },
    "categories": [68, 23],
    "featured_media": 0
  },
  {
    "id": 36836,
    "date": "2026-04-29T16:52:47",
    "title": {
      "rendered": "I grew up in the Boundary Waters. I don’t want to watch it change."
    },
    "categories": [8],
    "featured_media": 36839
  },
  {
    "id": 36835,
    "date": "2026-04-29T16:52:16",
    "title": {
      "rendered": "The artist’s mural"
    },
    "categories": [70, 23],
    "featured_media": 0
  },
  {
    "id": 36832,
    "date": "2026-04-29T16:50:52",
    "title": {
      "rendered": "A sunny thanks"
    },
    "categories": [63, 23],
    "featured_media": 36833
  },
  {
    "id": 36828,
    "date": "2026-04-29T16:49:27",
    "title": {
      "rendered": "Coloring Page: flying into summer"
    },
    "categories": [986, 23],
    "featured_media": 36831
  },
  {
    "id": 36824,
    "date": "2026-04-29T16:46:20",
    "title": {
      "rendered": "Horoscopes: sunset/sunrise"
    },
    "categories": [66, 23],
    "featured_media": 28773
  },
  {
    "id": 36822,
    "date": "2026-04-29T16:42:20",
    "title": {
      "rendered": "Spotify playlist: watching a sunset"
    },
    "categories": [68, 23],
    "featured_media": 0
  },
  {
    "id": 36819,
    "date": "2026-04-29T16:41:19",
    "title": {
      "rendered": "Mouse Friends: sunsets of life"
    },
    "categories": [63, 23],
    "featured_media": 36820
  },
  {
    "id": 36814,
    "date": "2026-04-29T16:39:27",
    "title": {
      "rendered": "Crossword: Sunrise &#038; Sunset"
    },
    "categories": [1059, 23],
    "featured_media": 0
  },
  {
    "id": 36807,
    "date": "2026-03-26T14:17:12",
    "title": {
      "rendered": "St. Olaf Faculty takes first steps to revise non-tenure-track policy"
    },
    "categories": [7],
    "featured_media": 36808
  },
  {
    "id": 36726,
    "date": "2026-03-25T19:35:13",
    "title": {
      "rendered": "Bon Appétit speaks on Stav bowl variety"
    },
    "categories": [45, 7],
    "featured_media": 36796
  },
  {
    "id": 36791,
    "date": "2026-03-25T19:23:43",
    "title": {